Category 1,Category 2,Category 3,Product Description,Price,Currency
Men,Clothing,Casual shirts,Slim Fit Oxford Shirt with Stretch,8.99,£
Men,Clothing,Casual shirts,Pure Cotton Oxford Shirt with Pocket,19.5,£
Men,Clothing,Casual shirts,Pure Cotton Oxford Shirt,17.5,£
Men,Clothing,Casual shirts,Slim Fit Oxford Shirt with Stretch,8.99,£
Men,Clothing,Casual shirts,Pure Cotton Oxford Shirt,17.5,£
Men,Clothing,Casual shirts,Pure Cotton Oxford Shirt with Pocket,19.5,£
Men,Clothing,Casual shirts,Pure Cotton Oxford Shirt,17.5,£
Men,Clothing,Casual shirts,Pure Cotton Oxford Shirt,17.5,£
Men,Clothing,Casual shirts,Pure Cotton Oxford Shirt,17.5,£
Men,Clothing,Casual shirts,Pure Cotton Oxford Shirt,17.5,£
Men,Clothing,Casual shirts,Pure Cotton Oxford Shirt with Pocket,19.5,£
Men,Clothing,Casual shirts,Pure Cotton Oxford Shirt,17.5,£
Men,Clothing,Casual shirts,Laundered Cotton Regular Fit Checked Shirt,19.5,£
Men,Clothing,Casual shirts,Pure Cotton Checked Shirt,19.5,£
Men,Clothing,Casual shirts,Linen Blend Grandad Shirt,29.5,£
Men,Clothing,Casual shirts,Pure Cotton Checked Shirt,19.5,£
Men,Clothing,Casual shirts,Palm Print Soft Touch Shirt,27.5,£
Men,Clothing,Casual shirts,Laundered Cotton Regular Fit Checked Shirt,19.5,£
Men,Clothing,Casual shirts,Pure Cotton Checked Shirt,25.0,£
Men,Clothing,Casual shirts,Pure Cotton Geometric Print Shirt,17.5,£
Men,Clothing,Casual shirts,Linen Blend Grandad Shirt,25.0,£
Men,Clothing,Casual shirts,Pure Cotton Checked Shirt,29.5,£
Men,Clothing,Casual shirts,Cotton Space Dye Checked Shirt,27.5,£
Men,Clothing,Casual shirts,Linen Blend Easy Iron Shirt,29.5,£
Men,Clothing,Casual shirts,Cotton Checked Shirt,29.5,£
Men,Clothing,Casual shirts,Linen Rich Easy Iron Shirt,25.0,£
Men,Clothing,Casual shirts,Pure Cotton Checked Shirt,29.5,£
Men,Clothing,Casual shirts,Pure Cotton Shirt,19.5,£
Men,Clothing,Casual shirts,Soft Touch Shirt,27.5,£
Men,Clothing,Casual shirts,Denim Shirt,29.5,£
Men,Clothing,Casual shirts,Printed Easy Iron Shirt,27.5,£
Men,Clothing,Casual shirts,Cotton Regular Fit Striped Shirt,29.5,£
Men,Clothing,Casual shirts,Pure Cotton Checked Shirt,29.5,£
Men,Clothing,Casual shirts,Linen Blend Easy Iron Regular Fit Shirt,29.5,£
Men,Clothing,Casual shirts,Printed Easy Iron Shirt,27.5,£
Men,Clothing,Casual shirts,Cotton Rich Palm Print Shirt,25.0,£
Men,Clothing,Casual shirts,Pure Cotton Checked Shirt,8.99,£
Men,Clothing,Chinos,Regular Fit Cotton Rich Stretch Chinos,15.0,£
Men,Clothing,Chinos,Slim Fit Cotton Rich Stretch Chinos,35.0,£
Men,Clothing,Chinos,Slim Fit Stretch Chinos,19.5,£
Men,Clothing,Chinos,Regular Fit Cotton Rich Stretch Chinos,35.0,£
Men,Clothing,Chinos,Super Lightweight Cotton Rich Chinos,39.5,£
Men,Clothing,Chinos,Regular Fit Cotton Stretch Chinos,35.0,£
Men,Clothing,Chinos,Slim Fit Italian Travel Stretch Chinos,45.0,£
Men,Clothing,Chinos,Super Lightweight Cotton Rich Chinos,39.5,£
Men,Clothing,Chinos,Slim Fit Smart Chinos,19.5,£
Men,Clothing,Chinos,Shorter Length Cotton Rich Stretch Chinos,19.5,£
Men,Clothing,Chinos,Slim Fit Cotton Belted Stretch Chinos,29.5,£
Men,Clothing,Chinos,Big & Tall Slim Fit Stretch Chinos,15.0,£
Men,Clothing,Chinos,Slim Fit Cotton Printed Stretch Chinos,29.5,£
Men,Clothing,Chinos,Skinny Fit Stretch Chinos,5.99,£
Men,Clothing,Chinos,Longer Length Skinny Fit Cotton Rich Chinos,5.99,£
Men,Clothing,Chinos,Shorter Length Skinny Fit Chinos,5.99,£
Men,Clothing,Coats & jackets,Cotton Denim Jacket,39.5,£
Men,Clothing,Coats & jackets,Leather Biker Jacket,179.0,£
Men,Clothing,Coats & jackets,Bomber Jacket with Stormwear™,45.0,£
Men,Clothing,Coats & jackets,Cotton Utility Jacket,69.0,£
Men,Clothing,Coats & jackets,Bomber Jacket with Stormwear™,59.0,£
Men,Clothing,Coats & jackets,Cotton Harrington Jacket with Stormwear™,59.0,£
Men,Clothing,Coats & jackets,Down & Feather Gilet with Stormwear™,39.5,£
Men,Clothing,Coats & jackets,Cotton Regular Fit Shacket,39.5,£
Men,Clothing,Coats & jackets,Mac with Stormwear™,69.0,£
Men,Clothing,Coats & jackets,Down & Feather Puffer Jacket with Stormwear™,59.0,£
Men,Clothing,Coats & jackets,Bomber Jacket with Stormwear™,59.0,£
Men,Clothing,Coats & jackets,Quilted Jacket with Stormwear™,79.0,£
Men,Clothing,Coats & jackets,Smart Biker Jacket with Stormwear™,69.0,£
Men,Clothing,Coats & jackets,Colour Block Jacket with Stormwear™,79.0,£
Men,Clothing,Coats & jackets,Faux Suede Biker Jacket,69.0,£
Men,Clothing,Coats & jackets,Hooded Parka with Stormwear™,49.5,£
Men,Clothing,Coats & jackets,Checked Mac with Stormwear™,89.0,£
Men,Clothing,Coats & jackets,Padded Longline Mac,129.0,£
Men,Clothing,Coats & jackets,Pure Cotton Corduroy Utility Jacket,79.0,£
Men,Clothing,Coats & jackets,Funnel Neck Mac with Stormwear,89.0,£
Men,Clothing,Coats & jackets,Cargo Parka with Stormwear™,89.0,£
Men,Clothing,Coats & jackets,Fleece Lined Jacket with Stormwear™,79.0,£
Men,Clothing,Coats & jackets,Cotton Utility Jacket,69.0,£
Men,Clothing,Coats & jackets,Down & Feather Gilet with Stormwear™,39.5,£
Men,Clothing,Coats & jackets,Cotton Utility Jacket with Stormwear,69.0,£
Men,Clothing,Coats & jackets,Mac with Stormwear™,69.0,£
Men,Clothing,Coats & jackets,Bomber Jacket with Stormwear,49.5,£
Men,Clothing,Coats & jackets,Textured Bomber Jacket Stormwear™,49.5,£
Men,Clothing,Coats & jackets,Wool Utility Jacket,79.0,£
Men,Clothing,Coats & jackets,Down & Feather Gilet with Stormwear™,39.5,£
Men,Clothing,Coats & jackets,Down & Feather Puffer Jacket,59.0,£
Men,Clothing,Coats & jackets,Down & Feather Gilet with Stormwear™,39.5,£
Men,Clothing,Coats & jackets,Padded Puffer Jacket,79.0,£
Men,Clothing,Coats & jackets,Corduroy Harrington Jacket,59.0,£
Men,Clothing,Coats & jackets,Quilted Bomber with Stormwear™,69.0,£
Men,Clothing,Coats & jackets,Funnel Neck Overcoat,34.99,£
Men,Clothing,Coats & jackets,Faux Fur Trim Parka with Thermowarmth™,29.99,£
Men,Clothing,Formal shirts,Regular Fit Cotton Non-Iron Shirt,29.5,£
Men,Clothing,Formal shirts,Tailored Fit Pure Cotton Shirt,45.0,£
Men,Clothing,Formal shirts,Slim Fit Cotton Shirt with Stretch,4.99,£
Men,Clothing,Formal shirts,Regular Fit Striped Non-Iron Shirt,29.5,£
Men,Clothing,Formal shirts,Tailored Fit Pure Cotton Oxford Shirt,4.99,£
Men,Clothing,Formal shirts,Pure Cotton Regular Fit Striped Shirt,29.5,£
Men,Clothing,Formal shirts,Regular Fit Textured Non-Iron Shirt,29.5,£
Men,Clothing,Formal shirts,Regular Fit Poplin Easy Iron Shirt,45.0,£
Men,Clothing,Formal shirts,Regular Fit Striped Non-Iron Shirt,29.5,£
Men,Clothing,Formal shirts,Slim Fit Non Iron Twill Shirt,29.5,£
Men,Clothing,Formal shirts,3 Pack Regular Fit Long Sleeve Shirts,36.0,£
Men,Clothing,Formal shirts,3 Pack Regular Fit Long Sleeve Shirts,36.0,£
Men,Clothing,Formal shirts,3 Pack Regular Fit Short Sleeve Shirts,30.0,£
Men,Clothing,Formal shirts,Tailored Fit Pure Cotton Shirt,45.0,£
Men,Clothing,Formal shirts,Regular Fit Checked Easy Iron Shirt,17.5,£
Men,Clothing,Formal shirts,Pure Cotton Regular Fit Striped Short Sleeve Shirt,25.0,£
Men,Clothing,Formal shirts,Regular Fit Twill Easy Iron Shirt,45.0,£
Men,Clothing,Formal shirts,2 Pack Regular Fit Checked Short Sleeve Shirts,27.5,£
Men,Clothing,Formal shirts,Regular Fit Pure Cotton Easy Iron Shirt,45.0,£
Men,Clothing,Formal shirts,2 Pack Cotton Striped Short Sleeve Shirts,27.5,£
Men,Clothing,Formal shirts,Pure Cotton Regular Fit Non-Iron Shirt,25.0,£
Men,Clothing,Formal shirts,Regular Fit Sateen Striped Shirt,45.0,£
Men,Clothing,Formal shirts,3 Pack Regular Fit Short Sleeve Shirts,30.0,£
Men,Clothing,Formal shirts,Slim Fit Cotton Rich Shirt with Stretch,19.5,£
Men,Clothing,Formal shirts,Slim Fit Shirt Easy Iron with Stretch,45.0,£
Men,Clothing,Formal shirts,Slim Fit Pure Cotton Easy Iron Shirt,45.0,£
Men,Clothing,Formal shirts,3 Pack Slim Fit Long Sleeve Shirts,36.0,£
Men,Clothing,Formal shirts,Regular Fit Short Sleeve Non-Iron Shirt,11.99,£
Men,Clothing,Formal shirts,2 Pack Regular Fit Checked Long Sleeve Shirts,30.0,£
Men,Clothing,Formal shirts,3 Pack Tailored Fit Short Sleeve Shirts,30.0,£
Men,Clothing,Formal shirts,2 Pack Regular Fit Striped Long Sleeve Shirts,30.0,£
Men,Clothing,Formal shirts,3 Pack Tailored Fit Long Sleeve Shirts,36.0,£
Men,Clothing,Formal shirts,Tailored Fit Pure Cotton Textured Shirt,14.99,£
Men,Clothing,Formal shirts,Regular Fit Pure Cotton Non-Iron Shirt,11.99,£
Men,Clothing,Formal shirts,Regular Fit Checked Pure Cotton Shirt,25.0,£
Men,Clothing,Formal shirts,Tailored Fit Pure Cotton Shirt,25.0,£
Men,Clothing,Formal shirts,3 Pack Tailored Fit Short Sleeve Shirts,30.0,£
Men,Clothing,Formal shirts,Regular Fit Pure Cotton Checked Shirt,45.0,£
Men,Clothing,Formal shirts,3 Pack Regular Fit Short Sleeve Shirts,30.0,£
Men,Clothing,Formal shirts,Regular Fit Pure Cotton Twill Non-Iron Shirt,11.99,£
Men,Clothing,Formal shirts,Regular Fit Pure Cotton Checked Shirt,29.5,£
Men,Clothing,Formal shirts,Tailored Fit Textured Easy Iron Shirt,17.5,£
Men,Clothing,Formal shirts,Pure Cotton Stripe Tailored Shirt,45.0,£
Men,Clothing,Formal shirts,3 Pack Slim Fit Long Sleeve Shirts,36.0,£
Men,Clothing,Formal shirts,Tailored Fit Pure Cotton Checked Shirt,45.0,£
Men,Clothing,Formal shirts,3 Pack Tailored Fit Long Sleeve Shirts,36.0,£
Men,Clothing,Formal shirts,Regular Fit Pure Cotton Checked Shirt,45.0,£
Men,Clothing,Formal shirts,5 Pack Tailored Fit Long Sleeve Shirts,55.0,£
Men,Clothing,Hoodies & sweatshirts,Cotton Zip Through Hoodie,25.0,£
Men,Clothing,Hoodies & sweatshirts,Cotton Crew Neck Sweatshirt,19.5,£
Men,Clothing,Hoodies & sweatshirts,Cotton Zip Through Knitted Hoodie,35.0,£
Men,Clothing,Hoodies & sweatshirts,Cotton Knitted Hoodie,35.0,£
Men,Clothing,Jeans,Regular Fit Stretch Jeans with Stormwear™,35.0,£
Men,Clothing,Jeans,Straight Fit Vintage Wash Stretch Jeans,29.5,£
Men,Clothing,Jeans,Slim Fit 360 Flex Jeans,39.5,£
Men,Clothing,Jeans,Slim Fit Vintage Wash Stretch Jeans,29.5,£
Men,Clothing,Jeans,Straight Fit Stretch Jeans,22.5,£
Men,Clothing,Jeans,Regular Fit Jeans,15.0,£
Men,Clothing,Jeans,Slim Fit Stretch Jeans,22.5,£
Men,Clothing,Jeans,Straight Vintage Wash Stretch Jeans,29.5,£
Men,Clothing,Jeans,Straight Fit 5 Pocket Stretch Trousers,22.5,£
Men,Clothing,Jeans,Regular Fit Jeans,15.0,£
Men,Clothing,Jeans,Tapered Fit Stretch Jeans,22.5,£
Men,Clothing,Jeans,Tapered Fit Stretch Jeans with Stormwear™,35.0,£
Men,Clothing,Jeans,Skinny Fit Stretch Jeans,22.5,£
Men,Clothing,Jeans,Shorter Length Regular Fit Stretch Jeans,35.0,£
Men,Clothing,Jeans,Skinny Fit Vintage Wash Stretch Jeans,29.5,£
Men,Clothing,Jeans,Big & Tall Regular Fit Stretch Jeans with Stormwear™,35.0,£
Men,Clothing,Jeans,Big & Tall Straight Fit Stretch Jeans,22.5,£
Men,Clothing,Jeans,Big & Tall Regular Fit Cotton Jeans,15.0,£
Men,Clothing,Jeans,Big & Tall Slim Fit Stretch Jeans,17.5,£
Men,Clothing,Jeans,Shorter Length Slim Fit Stretch Jeans,22.5,£
Men,Clothing,Jeans,Slim Fit 5 Pocket Stretch Trousers,22.5,£
Men,Clothing,Jeans,Shorter Length Skinny Fit Stretch Jeans,22.5,£
Men,Clothing,Jeans,Big & Tall Slim Fit 360 Flex Jeans,39.5,£
Men,Clothing,Jeans,Skinny Fit 5 Pocket Stretch Trousers,22.5,£
Men,Clothing,Jeans,Big & Tall Skinny Stretch Jeans,22.5,£
Men,Clothing,Jeans,Slim Fit Smart Jeans with Stretch,9.99,£
Men,Clothing,Jeans,Italian Cotton 5 Pocket Stretch Travel Jeans,9.99,£
Men,Clothing,Jeans,Skinny Fit Vintage Wash Stretch Jeans,9.99,£
Men,Clothing,Jeans,Slim Fit Vintage Wash Stretch Jeans,9.99,£
Men,Clothing,Joggers,Cotton Joggers,16.0,£
Men,Clothing,Joggers,Cotton Joggers,16.0,£
Men,Clothing,Joggers,Cotton Joggers,16.0,£
Men,Clothing,Joggers,Cotton Joggers,16.0,£
Men,Clothing,Joggers,Slim Fit Joggers,25.0,£
Men,Clothing,Joggers,Slim Fit Joggers,25.0,£
Men,Clothing,Joggers,Tapered Leg Joggers,19.5,£
Men,Clothing,Joggers,Tapered Leg Joggers,19.5,£
Men,Clothing,Joggers,Fleece Joggers,8.99,£
Men,Clothing,Jumpers & cardigans,Pure Cotton V-Neck Jumper,19.5,£
Men,Clothing,Jumpers & cardigans,Pure Cotton V-Neck Jumper,19.5,£
Men,Clothing,Jumpers & cardigans,Pure Cotton Crew Neck Jumper,19.5,£
Men,Clothing,Jumpers & cardigans,Pure Cotton V-Neck Jumper,19.5,£
Men,Clothing,Jumpers & cardigans,Pure Cotton Crew Neck Jumper,19.5,£
Men,Clothing,Jumpers & cardigans,Pure Cotton Crew Neck Jumper,19.5,£
Men,Clothing,Jumpers & cardigans,Pure Cotton Crew Neck Jumper,19.5,£
Men,Clothing,Jumpers & cardigans,Pure Cotton Crew Neck Jumper,19.5,£
Men,Clothing,Jumpers & cardigans,Cotton Zip Through Arm Stripe Cardigan,35.0,£
Men,Clothing,Jumpers & cardigans,Pure Extra Fine Merino Wool Funnel Neck Jumper,39.5,£
Men,Clothing,Jumpers & cardigans,Cotton V-Neck Cardigan,25.0,£
Men,Clothing,Jumpers & cardigans,Cotton Zip Through Bomber,39.5,£
Men,Clothing,Jumpers & cardigans,Pure Cashmere Crew Neck Jumper,89.0,£
Men,Clothing,Jumpers & cardigans,Pure Cotton Textured Jumper,25.0,£
Men,Clothing,Jumpers & cardigans,Cotton Crew Neck Sweatshirt,19.5,£
Men,Clothing,Jumpers & cardigans,Cashmilon™ V-Neck Jumper,16.0,£
Men,Clothing,Jumpers & cardigans,Pure Cashmere V-Neck Jumper,89.0,£
Men,Clothing,Jumpers & cardigans,Cotton Knitted Polo Shirt,25.0,£
Men,Clothing,Jumpers & cardigans,Pure Extra Fine Merino Wool V-Neck Cardigan,39.5,£
Men,Clothing,Jumpers & cardigans,Pure Cotton Textured Chest Stripe Jumper,25.0,£
Men,Clothing,Jumpers & cardigans,Pure Merino Wool Knitted Polo Shirt,39.5,£
Men,Clothing,Jumpers & cardigans,Pure Cotton Popper Knitted Jacket,39.5,£
Men,Clothing,Jumpers & cardigans,Zipped Through Knitted Bomber Jacket,35.0,£
Men,Clothing,Jumpers & cardigans,Silk Blend Zip Collar Knitted Polo Shirt,35.0,£
Men,Clothing,Jumpers & cardigans,Pure Cotton V-Neck Jumper,19.5,£
Men,Clothing,Jumpers & cardigans,Pure Cotton Textured Arm Stripe Jumper,25.0,£
Men,Clothing,Jumpers & cardigans,Cashmilon™ V-Neck Jumper,16.0,£
Men,Clothing,Jumpers & cardigans,Pure Extra Fine Merino Wool V-Neck Cardigan,39.5,£
Men,Clothing,Jumpers & cardigans,V-Neck Cardigan with Wool,45.0,£
Men,Clothing,Jumpers & cardigans,Pure Cotton V-Neck Jumper,19.5,£
Men,Clothing,Jumpers & cardigans,Cotton Knitted Hoodie,35.0,£
Men,Clothing,Jumpers & cardigans,Pure Lambswool Zip Through Cardigan,45.0,£
Men,Clothing,Jumpers & cardigans,Pure Cotton V-Neck Jumper,19.5,£
Men,Clothing,Jumpers & cardigans,Pure Cotton Zip Through Knitted Jacket,39.5,£
Men,Clothing,Jumpers & cardigans,Cashmilon™ V-Neck Jumper,16.0,£
Men,Clothing,Jumpers & cardigans,Pure Cotton V-Neck Jumper,19.5,£
Men,Clothing,Jumpers & cardigans,Cotton Chest Stripe Knitted Polo Shirt,25.0,£
Men,Clothing,Jumpers & cardigans,Cotton Striped Knitted Polo Shirt,25.0,£
Men,Clothing,Jumpers & cardigans,Pure Cashmere Zip Through Cardigan,119.0,£
Men,Clothing,Jumpers & cardigans,Cotton Zip Through Knitted Hoodie,35.0,£
Men,Clothing,Jumpers & cardigans,Pure Extra Fine Merino Wool V-Neck Cardigan,39.5,£
Men,Clothing,Jumpers & cardigans,Open V-Neck Knitted Polo Shirt with Silk,35.0,£
Men,Clothing,Jumpers & cardigans,Half Zip Knitted Polo Shirt with Silk,35.0,£
Men,Clothing,Jumpers & cardigans,Pure Cotton V-Neck Jumper,19.5,£
Men,Clothing,Jumpers & cardigans,Pure Cotton V-Neck Jumper,19.5,£
Men,Clothing,Jumpers & cardigans,Cotton Short Sleeve Knitted Polo Shirt,19.5,£
Men,Clothing,Jumpers & cardigans,Cotton Striped Knitted Polo Shirt,25.0,£
Men,Clothing,Jumpers & cardigans,Pure Cotton V-Neck Jumper,19.5,£
Men,Clothing,Polo shirts,Pure Cotton Wide Tipped Polo Shirt,15.0,£
Men,Clothing,Polo shirts,Pure Cotton Polo Shirt,15.0,£
Men,Clothing,Polo shirts,Textured Tipped Polo Shirt,29.5,£
Men,Clothing,Polo shirts,Pure Cotton Polo Shirt,15.0,£
Men,Clothing,Polo shirts,Silk Cotton Blend Knitted Polo Shirt,35.0,£
Men,Clothing,Polo shirts,Pure Cotton Polo Shirt,15.0,£
Men,Clothing,Polo shirts,Pure Cotton Textured Polo Shirt,15.0,£
Men,Clothing,Polo shirts,Cotton Short Sleeve Knitted Polo Shirt,19.5,£
Men,Clothing,Polo shirts,Pure Cotton Palm Print Polo Shirt,19.5,£
Men,Clothing,Polo shirts,Cotton Striped Polo Shirt,17.5,£
Men,Clothing,Polo shirts,Cotton Knitted Polo Shirt,25.0,£
Men,Clothing,Polo shirts,Pure Cotton Polo Shirt,15.0,£
Men,Clothing,Polo shirts,Pure Cotton Textured Polo Shirt,15.0,£
Men,Clothing,Polo shirts,Supima® Cotton Textured Polo Shirt,29.5,£
Men,Clothing,Polo shirts,Half Zip Knitted Polo Shirt with Silk,35.0,£
Men,Clothing,Polo shirts,Silk Cotton Blend Knitted Polo Shirt,35.0,£
Men,Clothing,Polo shirts,Pure Cotton Polo Shirt,15.0,£
Men,Clothing,Polo shirts,Cotton Striped Knitted Polo Shirt,25.0,£
Men,Clothing,Polo shirts,Pure Cotton Polo Shirt,15.0,£
Men,Clothing,Polo shirts,Pure Cotton Striped Knitted Polo Shirt,22.5,£
Men,Clothing,Polo shirts,Pure Cotton Textured Polo Shirt,15.0,£
Men,Clothing,Polo shirts,Pure Cotton Geometric Polo Shirt,25.0,£
Men,Clothing,Polo shirts,Cotton Chest Stripe Knitted Polo Shirt,25.0,£
Men,Clothing,Polo shirts,Pure Cotton Double Stripe Polo Shirt,17.5,£
Men,Clothing,Polo shirts,Pure Cotton Polo Shirt,15.0,£
Men,Clothing,Polo shirts,Silk Blend Zip Collar Knitted Polo Shirt,35.0,£
Men,Clothing,Polo shirts,Cotton Striped Knitted Polo Shirt,25.0,£
Men,Clothing,Polo shirts,Pure Cotton Wide Tipped Polo Shirt,15.0,£
Men,Clothing,Polo shirts,Pure Cotton Textured Polo Shirt,15.0,£
Men,Clothing,Polo shirts,Cotton Striped Polo Shirt,17.5,£
Men,Clothing,Polo shirts,Pure Cotton Geometric Print Polo Shirt,19.5,£
Men,Clothing,Polo shirts,Pure Cotton Polo Shirt,15.0,£
Men,Clothing,Polo shirts,Pure Cotton Textured Polo Shirt,15.0,£
Men,Clothing,Polo shirts,Pure Cotton Double Stripe Polo Shirt,17.5,£
Men,Clothing,Polo shirts,Open V-Neck Knitted Polo Shirt with Silk,35.0,£
Men,Clothing,Polo shirts,Pure Cotton Wide Tipped Polo Shirt,15.0,£
Men,Clothing,Polo shirts,Cotton Knitted Polo Shirt,29.5,£
Men,Clothing,Polo shirts,Supima® Cotton Half Zip Polo Shirt,29.5,£
Men,Clothing,Polo shirts,Pure Cotton Polo Shirt,15.0,£
Men,Clothing,Polo shirts,Pure Cotton Striped Knitted Polo Shirt,22.5,£
Men,Clothing,Polo shirts,Pure Cotton Polo Shirt,15.0,£
Men,Clothing,Polo shirts,Cotton Rich Striped Knitted Polo Shirt,25.0,£
Men,Clothing,Polo shirts,Pure Cotton Half Zip Polo Shirt,25.0,£
Men,Clothing,Polo shirts,Cotton Colour Block Knitted Polo Shirt,25.0,£
Men,Clothing,Polo shirts,Pure Cotton Striped Polo Shirt,19.5,£
Men,Clothing,Polo shirts,Pure Cotton Wide Tipped Polo Shirt,15.0,£
Men,Clothing,Polo shirts,Pure Cotton Textured Polo Shirt,15.0,£
Men,Clothing,Polo shirts,Pure Cotton Slim Fit Striped Polo Shirt,19.5,£
Men,Clothing,Shorts,Super Lightweight Chino Shorts,25.0,£
Men,Clothing,Shorts,Cotton Stretch 5 Pocket Shorts,19.5,£
Men,Clothing,Shorts,Slim Fit Stretch Denim Shorts,19.5,£
Men,Clothing,Shorts,Slim Fit Stretch Denim Shorts,25.0,£
Men,Clothing,Shorts,Cotton Stretch Chino Shorts,15.0,£
Men,Clothing,Shorts,Pure Cotton Cargo Shorts,25.0,£
Men,Clothing,Shorts,Trekking Short with Stormwear,29.5,£
Men,Clothing,Shorts,Trekking Shorts with Stormwear™,29.5,£
Men,Clothing,Shorts,Cotton 3/4 Leg Trekking Shorts,35.0,£
Men,Clothing,Shorts,Cotton Chino Shorts,25.0,£
Men,Clothing,Shorts,Cotton Checked Chino Shorts with Belt,29.5,£
Men,Clothing,Shorts,Big & Tall Cotton Chino Shorts,25.0,£
Men,Clothing,Shorts,Linen Striped Shorts,29.5,£
Men,Clothing,Shorts,Cotton Belted Printed Shorts,29.5,£
Men,Clothing,Shorts,Cotton Flat Front Smart Shorts,25.0,£
Men,Clothing,Shorts,Seersucker Shorts,29.5,£
Men,Clothing,Shorts,Belted Utility Shorts,25.0,£
Men,Clothing,Shorts,Cotton Pattern Stretch Chino Shorts,29.5,£
Men,Clothing,Shorts,Cotton Chino Shorts,29.5,£
Men,Clothing,Shorts,Cotton Striped Chino Shorts,29.5,£
Men,Clothing,Shorts,Cotton Printed Shorts,22.5,£
Men,Clothing,Shorts,Cotton Pattern Stretch Chino Shorts,29.5,£
Men,Clothing,Shorts,Cotton Palm Print Shorts,22.5,£
Men,Clothing,Shorts,Cotton Palm Print Shorts,22.5,£
Men,Clothing,Shorts,Active Print Panel Shorts,19.5,£
Men,Clothing,Shorts,Active Reflective Shorts,19.5,£
Men,Clothing,Sportswear,Sleeveless Vest,12.5,£
Men,Clothing,Sportswear,Slim Fit Joggers,25.0,£
Men,Clothing,Sportswear,Active Reflective Trim Seam Free T-shirt,17.5,£
Men,Clothing,Sportswear,Active Reflective Trim T-Shirt,15.0,£
Men,Clothing,Sportswear,Active Ombre T-Shirt,19.5,£
Men,Clothing,Sportswear,Lace-up Trainers,20.0,£
Men,Clothing,Sportswear,Chunky Sole Trainers,28.0,£
Men,Clothing,Sportswear,Active Print Panel Shorts,19.5,£
Men,Clothing,Sportswear,Cotton Joggers,16.0,£
Men,Clothing,Sportswear,Active Reflective Shorts,19.5,£
Men,Clothing,Sportswear,Cotton Zip Through Hoodie,25.0,£
Men,Clothing,Sportswear,Cotton Joggers,16.0,£
Men,Clothing,Sportswear,Cotton Joggers,16.0,£
Men,Clothing,Sportswear,Cotton Joggers,16.0,£
Men,Clothing,Sportswear,Active Full Length Leggings,19.5,£
Men,Clothing,Sportswear,Slim Fit Joggers,25.0,£
Men,Clothing,Sportswear,Cotton Crew Neck Sweatshirt,19.5,£
Men,Clothing,Sportswear,Down & Feather Gilet with Stormwear™,39.5,£
Men,Clothing,Sportswear,Cotton Knitted Hoodie,35.0,£
Men,Clothing,Sportswear,Tapered Leg Joggers,19.5,£
Men,Clothing,Sportswear,Cotton Zip Through Knitted Hoodie,35.0,£
Men,Clothing,Sportswear,Tapered Leg Joggers,19.5,£
Men,Clothing,Sportswear,Chunky Sole Trainers,28.0,£
Men,Clothing,Sportswear,Chunky Sole Trainers,28.0,£
Men,Clothing,Sportswear,Chunky Sole Trainers,28.0,£
Men,Clothing,Sportswear,Quick Dry Colour Block Swim Shorts,12.5,£
Men,Clothing,Sportswear,Quick Dry Colour Block Swim Shorts,12.5,£
Men,Clothing,Sportswear,Quick Dry Camouflage Print Swim Shorts,17.5,£
Men,Clothing,Sportswear,Quick Dry Seersucker Swim Shorts,17.5,£
Men,Clothing,Sportswear,Quick Dry Dip Dye Print Swim Shorts,17.5,£
Men,Clothing,Sportswear,Quick Dry Side Stripe Swim Shorts,15.0,£
Men,Clothing,Sportswear,Quick Dry Corn Print Swim Shorts,17.5,£
Men,Clothing,Sportswear,Contrast Swim Shorts,12.5,£
Men,Clothing,Sportswear,Fleece Joggers,8.99,£
Men,Clothing,Sportswear,Down & Feather Puffer Jacket with Stormwear™,59.0,£
Men,Clothing,Sportswear,Down & Feather Gilet with Stormwear™,39.5,£
Men,Clothing,Sportswear,Down & Feather Gilet with Stormwear™,39.5,£
Men,Clothing,Sportswear,Colour Block Jacket with Stormwear™,79.0,£
Men,Clothing,Sportswear,Down & Feather Puffer Jacket,59.0,£
Men,Clothing,Sportswear,Hooded Parka with Stormwear™,49.5,£
Men,Clothing,Sportswear,Down & Feather Gilet with Stormwear™,39.5,£
Men,Clothing,Sportswear,Contrast Swim Shorts,12.5,£
Men,Clothing,Suits,Regular Fit Suit with Stretch,99.0,£
Men,Clothing,Suits,The Ultimate Navy Regular Fit Suit,149.0,£
Men,Clothing,Suits,Big & Tall Navy Regular Fit Wool Suit,199.0,£
Men,Clothing,Suits,Regular Fit Suit,79.0,£
Men,Clothing,Suits,Big & Tall Black Regular Fit Suit,149.0,£
Men,Clothing,Suits,Regular Fit Suit with Stretch,99.0,£
Men,Clothing,Suits,The Ultimate Charcoal Regular Fit Suit,149.0,£
Men,Clothing,Suits,Navy Regular Fit Wool Suit,199.0,£
Men,Clothing,Suits,Black Slim Fit Suit with Stretch,99.0,£
Men,Clothing,Suits,Black Tailored Fit Wool Suit,199.0,£
Men,Clothing,Suits,The Ultimate Black Tailored Fit Suit,149.0,£
Men,Clothing,Suits,Blue Tailored Fit Wool Rich Checked Suit,199.0,£
Men,Clothing,Suits,Navy Regular Fit Suit,79.0,£
Men,Clothing,Suits,Blue Regular Fit 3 Piece Suit,184.0,£
Men,Clothing,Suits,Grey Textured Regular Fit 3 Piece Suit,184.0,£
Men,Clothing,Suits,Navy Regular Fit Wool 3 Piece Suit,264.0,£
Men,Clothing,Suits,Black Regular Fit Wool Blend Morning Suit,199.0,£
Men,Clothing,Suits,Navy Regular Fit Dinner Suit,89.0,£
Men,Clothing,Suits,Black Regular Fit Tuxedo Suit,89.0,£
Men,Clothing,Suits,The Ultimate Black Regular Fit Suit,149.0,£
Men,Clothing,Suits,Navy Regular Fit Wool Blend Suit,139.0,£
Men,Clothing,Suits,Charcoal Regular Fit Wool Checked Suit,199.0,£
Men,Clothing,Suits,The Ultimate Blue Regular Fit Suit,149.0,£
Men,Clothing,Suits,Black Regular Fit Dinner Suit,139.0,£
Men,Clothing,Suits,Regular Fit Suit with Stretch,99.0,£
Men,Clothing,Suits,Black Regular Fit Suit,99.0,£
Men,Clothing,Suits,Charcoal Regular Fit Checked Suit,119.0,£
Men,Clothing,Suits,Pastel Regular Fit Suit,119.0,£
Men,Clothing,Suits,Blue Regular Fit Suit,119.0,£
Men,Clothing,Suits,Regular Fit 3 Piece Suit,98.5,£
Men,Clothing,Suits,Regular Fit Italian Linen Miracle™ Suit,149.0,£
Men,Clothing,Suits,Regular Fit Suit,79.0,£
Men,Clothing,Suits,Grey Textured Regular Fit Suit,139.0,£
Men,Clothing,Suits,Blue Regular Fit Checked Suit,119.0,£
Men,Clothing,Suits,Blue Regular Fit Suit,139.0,£
Men,Clothing,Suits,Regular Fit 3 Piece Suit,98.5,£
Men,Clothing,Suits,Regular Fit Italian Linen Miracle™ Suit,149.0,£
Men,Clothing,Suits,Textured Tailored Fit Suit,119.0,£
Men,Clothing,Suits,Black Tailored Fit Wool 3 Piece Suit,264.0,£
Men,Clothing,Suits,Tailored Fit Italian Linen Miracle™ 3 Piece Suit,188.0,£
Men,Clothing,Suits,Slim Fit 3 Piece Checked Suit,154.0,£
Men,Clothing,Suits,Blue Slim Fit Checked 3 Piece Suit,154.0,£
Men,Clothing,Suits,Tailored Fit 3 Piece Checked Suit,154.0,£
Men,Clothing,Suits,Tailored Fit 3 Piece Suit,154.0,£
Men,Clothing,Suits,Blue Tailored Fit Wool 3 Piece Suit,388.0,£
Men,Clothing,Suits,The Ultimate Charcoal Tailored Fit 3 Piece Suit,198.5,£
Men,Clothing,Suits,The Ultimate Blue Skinny Fit 3 Piece Suit,198.5,£
Men,Clothing,Suits,Blue Checked Slim Fit Wool 3 Piece Suit,264.0,£
Men,Clothing,T-shirts,Men’s NHS Charities Together T-Shirt,9.5,£
Men,Clothing,T-shirts,Men's NHS Charities Together Clap Hands T-Shirt,9.5,£
Men,Clothing,T-shirts,Men’s NHS Charities Together T-Shirt,9.5,£
Men,Clothing,T-shirts,Pure Cotton Crocodile Print Pocket T-Shirt,12.5,£
Men,Clothing,T-shirts,Pure Cotton Crew Neck T-Shirt,6.0,£
Men,Clothing,T-shirts,Pure Cotton Crew Neck T-Shirt,6.0,£
Men,Clothing,T-shirts,Pure Cotton Striped T-Shirt,12.5,£
Men,Clothing,T-shirts,Pure Cotton Striped T-Shirt,12.5,£
Men,Clothing,T-shirts,Pure Cotton Bike Print T-Shirt,12.5,£
