Category 1,Category 2,Category 3,Product Description,Price,Currency
Women,Clothing,Support the nhs,Women's NHS Charities Together Slogan T-Shirt,9.5,£
Women,Clothing,Support the nhs,Women's NHS Charities Together Slogan T-Shirt,9.5,£
Women,Clothing,Support the nhs,Kids' NHS Charities Together T-Shirt (2-12 Yrs),8.0,£
Women,Clothing,Support the nhs,Women's NHS Charities Together T-Shirt,9.5,£
Women,Clothing,Support the nhs,Men’s NHS Charities Together T-Shirt,9.5,£
Women,Clothing,Support the nhs,Women's NHS Charities Together T-Shirt,9.5,£
Women,Clothing,Support the nhs,Men’s NHS Charities Together T-Shirt,9.5,£
Women,Clothing,Support the nhs,Women's NHS Charities Together Rainbow T-Shirt,9.5,£
Women,Clothing,Support the nhs,Women's NHS Charities Together Rainbow T-Shirt,9.5,£
Women,Clothing,Support the nhs,Men's NHS Charities Together Clap Hands T-Shirt,9.5,£
Women,Clothing,Support the nhs,Men's NHS Charities Together Clap Hands T-Shirt,9.5,£
Women,Clothing,Support the nhs,We're All in this Together Volunteer E-Gift Card,10.0,£
Women,Clothing,New in,Striped V-Neck Tiered Midi Relaxed Dress,45.0,£
Women,Clothing,New in,Floral High Neck Midi Relaxed Dress,45.0,£
Women,Clothing,New in,Striped V-Neck Relaxed Short Sleeve Top,15.0,£
Women,Clothing,New in,Boyfriend Ripped Jeans,35.0,£
Women,Clothing,New in,Women's NHS Charities Together Slogan T-Shirt,9.5,£
Women,Clothing,New in,Women's NHS Charities Together Slogan T-Shirt,9.5,£
Women,Clothing,New in,Women's NHS Charities Together Rainbow T-Shirt,9.5,£
Women,Clothing,New in,Luxe Touch Striped Relaxed Tie Hem Top,15.0,£
Women,Clothing,New in,Cotton blend Edge to Edge Overcoat,79.0,£
Women,Clothing,New in,Leather Two Band Sandals,31.6,£
Women,Clothing,New in,Woven Polka Dot Short Sleeve Blouse,17.5,£
Women,Clothing,New in,Denim Long Sleeve Jumpsuit,59.0,£
Women,Clothing,New in,Pure Cotton Ditsy Floral Midi Waisted Dress,49.5,£
Women,Clothing,New in,Cotton Belted Midi Shirt Dress,45.0,£
Women,Clothing,New in,Jersey Striped Knee Length Swing Dress,19.5,£
Women,Clothing,New in,Cotton Fitted Sleeveless Shirt,15.0,£
Women,Clothing,New in,Tailored Chino Shorts,29.5,£
Women,Clothing,New in,Round Neck Relaxed T-Shirt,12.5,£
Women,Clothing,New in,Cotton Rich Skinny Button Front Jeans,45.0,£
Women,Clothing,New in,Jersey Floral Knee Length Swing Dress,19.5,£
Women,Clothing,New in,Pure Cotton Mini Shift Dress,39.5,£
Women,Clothing,New in,Suede Lace Up Trainers,39.6,£
Women,Clothing,New in,Cotton Pleat Front Chino Shorts,29.5,£
Women,Clothing,New in,Pure Cotton Textured V-Neck T-Shirt,25.0,£
Women,Clothing,New in,Drawstring Wide Leg Trousers,35.0,£
Women,Clothing,New in,Flat Almond Toe Mules,15.6,£
Women,Clothing,New in,3/4 Sleeve Relaxed Shirt,25.0,£
Women,Clothing,New in,Pure Cotton Striped Shorts,25.0,£
Women,Clothing,New in,Relaxed Sleeveless Tank Top,5.5,£
Women,Clothing,New in,Crepe Floral V-Neck Knee Length Shift Dress,19.5,£
Women,Clothing,New in,V-Neck Vest,19.5,£
Women,Clothing,New in,Pure Cotton Frill Detail Mini Waisted Dress,39.5,£
Women,Clothing,New in,Tie-Dye V-Neck Relaxed Longline Top,8.5,£
Women,Clothing,New in,Dash Print Mini Relaxed Dress,39.5,£
Women,Clothing,New in,Printed One Shoulder Maxi Beach Dress,16.8,£
Women,Clothing,New in,Gingham Tiered Maxi Fit & Flare Skirt,35.0,£
Women,Clothing,New in,Tweed Checked Dress,69.0,£
Women,Clothing,New in,Pure Cotton Scoop Neck Regular Fit Vest,5.5,£
Women,Clothing,New in,Crepe Striped V-Neck Shift Dress,19.5,£
Women,Clothing,New in,Pure Cotton Printed Short Sleeve Blouse,15.0,£
Women,Clothing,New in,Denim Button Detailed Midi Skirt,35.0,£
Women,Clothing,New in,Striped Button Front Midi A-Line Skirt,17.5,£
Women,Clothing,New in,Printed V-Neck Vest,19.5,£
Women,Clothing,New in,Striped V-Neck Long Sleeve Popover Top,25.0,£
Women,Clothing,New in,Floral 3/4 Sleeve Belted Jumpsuit,45.0,£
Women,Clothing,New in,Striped Wide Leg Cropped Culottes,35.0,£
Women,Clothing,New in,Jersey Floral Tapered Peg Trousers,22.5,£
Women,Clothing,New in,Pure Cotton Floral Scoop Neck Vest,5.5,£
Women,Clothing,Loungewear,Tencel™ Utility Tapered Trousers,35.0,£
Women,Clothing,Loungewear,Linen Rich Shorts,14.0,£
Women,Clothing,Loungewear,Cotton Rich Straight Leg Joggers,12.5,£
Women,Clothing,Loungewear,Cotton Rich Straight Leg Ankle Grazer Jogger,25.0,£
Women,Clothing,Loungewear,Pure Cotton Striped Straight Fit T-Shirt,6.5,£
Women,Clothing,Loungewear,Cotton Shorts,12.5,£
Women,Clothing,Loungewear,Cotton V-Neck Fitted T-Shirt,6.5,£
Women,Clothing,Loungewear,Magic High Waist Leggings,19.5,£
Women,Clothing,Loungewear,Side Stripe Slim Fit Cuffed Joggers,25.0,£
Women,Clothing,Loungewear,Cotton Zip Through Hoodie,25.0,£
Women,Clothing,Loungewear,High Waist Leggings,9.5,£
Women,Clothing,Loungewear,Cotton Culottes,19.5,£
Women,Clothing,Loungewear,Pure Cotton Striped Midi T-Shirt Dress,19.5,£
Women,Clothing,Loungewear,Luxe Touch V Neck Relaxed Long Sleeve Top,15.0,£
Women,Clothing,Loungewear,V-Neck Relaxed Longline T-Shirt,8.5,£
Women,Clothing,Loungewear,Cotton Rich Straight Leg Cropped Jogger,9.5,£
Women,Clothing,Loungewear,Side Stripe Tapered Ankle Grazer Trousers,25.0,£
Women,Clothing,Loungewear,Jersey Star Print Tapered Ankle Grazer Trousers,22.5,£
Women,Clothing,Loungewear,Luxe Touch V Neck T-Shirt,12.5,£
Women,Clothing,Loungewear,Tencel™ Rich Utility Tapered Trousers,35.0,£
Women,Clothing,Loungewear,Cotton Side Stripe Straight Leg Joggers,15.0,£
Women,Clothing,Loungewear,Pure Cotton Striped Cropped Pyjama Set,12.5,£
Women,Clothing,Loungewear,Jersey Wide Leg Trousers,25.0,£
Women,Clothing,Loungewear,Cotton Spot Print Cropped Pyjama Bottoms,10.0,£
Women,Clothing,Loungewear,Cotton Rich Cargo Ankle Grazer Trousers,25.0,£
Women,Clothing,Loungewear,Cotton Rich Wide Leg Ankle Grazer Trousers,25.0,£
Women,Clothing,Loungewear,Cargo Utility Tapered Ankle Grazer Trousers,29.5,£
Women,Clothing,Loungewear,Printed Jersey Tapered Ankle Grazer Trousers,22.5,£
Women,Clothing,Loungewear,Cotton Rich Sweatshirt,25.0,£
Women,Clothing,Loungewear,Soft Touch Polka Dot Hooded Sweatshirt,25.0,£
Women,Clothing,Loungewear,Pure Cotton Longline Hoodie,27.5,£
Women,Clothing,Loungewear,Cotton Sofa So Good Slogan Pyjama Top,6.0,£
Women,Clothing,Loungewear,Jersey Tapered Ankle Grazer Trousers,22.5,£
Women,Clothing,Loungewear,Pure Cotton T-Shirt Mini Dress,15.0,£
Women,Clothing,Loungewear,2 Pack High Waist Leggings,15.0,£
Women,Clothing,Loungewear,Cotton Rich Cuffed Joggers,25.0,£
Women,Clothing,Loungewear,Pure Cotton Butterfly Print Pyjama Set,12.5,£
Women,Clothing,Loungewear,Cotton Tropical Floral Print Pyjama Bottoms,15.0,£
Women,Clothing,Loungewear,Relaxed Short Sleeve T-Shirt,6.5,£
Women,Clothing,Loungewear,Cotton Rich Cargo Straight Leg Trousers,29.5,£
Women,Clothing,Loungewear,Performance Cuffed Joggers,25.0,£
Women,Clothing,Loungewear,Pure Cotton Ombre Sweatshirt,25.0,£
Women,Clothing,Loungewear,Luxe Touch V-Neck Relaxed Top,15.0,£
Women,Clothing,Loungewear,Cotton Striped Cropped Pyjama Bottoms,10.0,£
Women,Clothing,Loungewear,Pure Cotton Striped Longline Tunic,25.0,£
Women,Clothing,Loungewear,Linen Rich Wide Leg Trousers,18.0,£
Women,Clothing,Loungewear,Pure Cotton Longline Hoodie,27.5,£
Women,Clothing,Loungewear,Jersey Straight Leg Trousers,15.0,£
Women,Clothing,Tops & t-shirts,Women's NHS Charities Together Rainbow T-Shirt,9.5,£
Women,Clothing,Tops & t-shirts,Animal Print Waisted Long Sleeve Blouse,19.5,£
Women,Clothing,Tops & t-shirts,Women's NHS Charities Together Slogan T-Shirt,9.5,£
Women,Clothing,Tops & t-shirts,Women's NHS Charities Together Slogan T-Shirt,9.5,£
Women,Clothing,Tops & t-shirts,Printed Ruffle Detailed Blouse,35.0,£
Women,Clothing,Tops & t-shirts,V-Neck Longline Short Sleeve Popover Blouse,29.5,£
Women,Clothing,Tops & t-shirts,Pure Linen Button Detailed Blouse,20.0,£
Women,Clothing,Tops & t-shirts,V-Neck Popover Blouse,11.7,£
Women,Clothing,Tops & t-shirts,V-Neck Shell Top,17.5,£
Women,Clothing,Tops & t-shirts,Printed Sleeveless V-Neck Shell Top,17.5,£
Women,Clothing,Tops & t-shirts,Pure Cotton Striped Relaxed Shirt,19.5,£
Women,Clothing,Tops & t-shirts,Printed Woven Blouse,17.5,£
Women,Clothing,Tops & t-shirts,V-Neck Vest,19.5,£
Women,Clothing,Tops & t-shirts,Floral Disty Woven Short Sleeve Blouse,17.5,£
Women,Clothing,Tops & t-shirts,Polka Dot Waisted Long Sleeve Blouse,25.0,£
Women,Clothing,Tops & t-shirts,Pure Cotton Polka Dot Blouse,17.5,£
Women,Clothing,Tops & t-shirts,Plisse Floral Long Sleeve Top,17.7,£
Women,Clothing,Tops & t-shirts,Polka Dot Tie Neck Relaxed Long Sleeve Top,10.5,£
Women,Clothing,Tops & t-shirts,Long Sleeve Top,15.0,£
Women,Clothing,Tops & t-shirts,Pleat Front Woven Blouse,11.7,£
Women,Clothing,Tops & t-shirts,Pure Cotton Relaxed Long Sleeve Shirt,19.5,£
Women,Clothing,Tops & t-shirts,Geometric Print Pleated Waist Shell Top,21.0,£
Women,Clothing,Tops & t-shirts,Waisted Short Sleeve Blouse,15.0,£
Women,Clothing,Tops & t-shirts,Printed Button Detail Top,9.0,£
Women,Clothing,Tops & t-shirts,Short Sleeve Blouse,11.7,£
Women,Clothing,Tops & t-shirts,Pure Linen Shirt,22.0,£
Women,Clothing,Tops & t-shirts,Printed V-Neck Short Sleeve Waisted Blouse,17.7,£
Women,Clothing,Tops & t-shirts,Floral Print Popover Blouse,11.7,£
Women,Clothing,Tops & t-shirts,Printed Woven Short Sleeve Blouse,17.5,£
Women,Clothing,Tops & t-shirts,Cotton Rich Striped Long Sleeve Blouse,29.5,£
Women,Clothing,Tops & t-shirts,Satin Floral Longline Short Sleeve Blouse,29.5,£
Women,Clothing,Tops & t-shirts,Floral V-Neck Sleeveless Shell Top,17.5,£
Women,Clothing,Tops & t-shirts,Floral Tie Neck Relaxed Long Sleeve Top,10.5,£
Women,Clothing,Tops & t-shirts,Polka Dot V-Neck Flutter Sleeve Blouse,17.7,£
Women,Clothing,Tops & t-shirts,Printed Blouse,11.7,£
Women,Clothing,Tops & t-shirts,Pure Cotton Printed Relaxed Blouse,15.0,£
Women,Clothing,Tops & t-shirts,Woven Short Sleeve Blouse,17.5,£
Women,Clothing,Tops & t-shirts,Pure Cotton Printed High Neck Blouse,25.0,£
Women,Clothing,Tops & t-shirts,V-Neck Relaxed Blouse,10.5,£
Women,Clothing,Tops & t-shirts,Polka Dot Long Sleeve Shirt,23.7,£
Women,Clothing,Tops & t-shirts,Pure Cotton Floral Long Sleeve Blouse,17.7,£
Women,Clothing,Tops & t-shirts,Floral Pleat Front Short Sleeve Blouse,11.7,£
Women,Clothing,Tops & t-shirts,Pure Tencel™ Sleeveless Shirt,25.0,£
Women,Clothing,Tops & t-shirts,Waisted Long Sleeve Blouse,25.0,£
Women,Clothing,Tops & t-shirts,Striped Popover Blouse,11.7,£
Women,Clothing,Tops & t-shirts,Cotton Rich Long Sleeve Blouse,29.5,£
Women,Clothing,Tops & t-shirts,Pure Linen Square Neck Button Detail Blouse,20.0,£
Women,Clothing,Tops & t-shirts,Pure Cotton Printed Short Sleeve Blouse,15.0,£
Women,Clothing,Linen,Linen Rich Wide Leg Trousers,18.0,£
Women,Clothing,Linen,Linen Rich Wide Leg Trousers,18.0,£
Women,Clothing,Linen,Linen Rich Floral Print Peg Trousers,15.6,£
Women,Clothing,Linen,Pure Linen Popover Blouse,22.0,£
Women,Clothing,Linen,Pure Linen V-Neck Shift Dress,31.6,£
Women,Clothing,Linen,Linen Spot Notch Neck Shift Dress,20.0,£
Women,Clothing,Linen,Pure Linen Checked Short Sleeve Blouse,20.0,£
Women,Clothing,Linen,Linen Rich Ruched Sleeve Blazer,36.0,£
Women,Clothing,Linen,Linen Floral Knee Length Shift Dress,20.0,£
Women,Clothing,Linen,Linen Striped Knee Length Shift Dress,20.0,£
Women,Clothing,Linen,Pure Linen Floral Popover Blouse,22.0,£
Women,Clothing,Linen,Pure Linen V-Neck Midi Waisted Dress,36.0,£
Women,Clothing,Linen,Pure Linen V-Neck Shift Dress,31.6,£
Women,Clothing,Linen,Pure Linen Striped Long Sleeve Shirt,22.0,£
Women,Clothing,Linen,Pure Linen Floral Popover Blouse,22.0,£
Women,Clothing,Linen,Linen Ribbed Longline Cardigan,23.6,£
Women,Clothing,Linen,Tencel™ Cargo Straight Ankle Grazer Trousers,31.6,£
Women,Clothing,Linen,Pure Linen Floral Long Sleeve Shirt,22.0,£
Women,Clothing,Linen,Linen Ribbed Longline Cardigan,23.6,£
Women,Clothing,Linen,Tencel™ Cargo Straight Ankle Grazer Trousers,31.6,£
Women,Clothing,Linen,Pure Linen Shirt,22.0,£
Women,Clothing,Linen,Pure Linen Button Detailed Blouse,20.0,£
Women,Clothing,Linen,Linen Blend Tapered Ankle Grazer Trousers,15.6,£
Women,Clothing,Linen,Pure Linen Floral Print Woven Blouse,20.0,£
Women,Clothing,Linen,Linen Drawstring Wide Leg Trousers,18.0,£
Women,Clothing,Linen,Pure Linen Square Neck Camisole Top,20.0,£
Women,Clothing,Linen,Linen Rich Wide Leg Trousers,18.0,£
Women,Clothing,Linen,Pure Linen Square Neck Button Detail Blouse,20.0,£
Women,Clothing,Linen,Linen Blend Tapered Ankle Grazer Trousers,15.6,£
Women,Clothing,Linen,Linen Side Button Midi Shift Dress,28.0,£
Women,Clothing,Linen,Linen Rich Wide Leg Trousers,18.0,£
Women,Clothing,Linen,Pure Linen Square Neck Button Detail Blouse,20.0,£
Women,Clothing,Linen,Tailored Linen Rich Shorts,23.6,£
Women,Clothing,Linen,Pure Linen Striped Short Sleeve Top,20.0,£
Women,Clothing,Linen,Linen Blend Tapered Ankle Grazer Trousers,15.6,£
Women,Clothing,Linen,Pure Linen Striped Single Breasted Blazer,44.0,£
Women,Clothing,Linen,Linen Rich Wrap Skirt,28.0,£
Women,Clothing,Linen,Pure Linen Popover Blouse,22.0,£
Women,Clothing,Linen,Pure Linen Relaxed Short Sleeve Blouse,23.6,£
Women,Clothing,Linen,Pure Linen Popover Blouse,22.0,£
Women,Clothing,Linen,Linen Single Breasted Blazer,55.2,£
Women,Clothing,Linen,Linen Striped Side Button Midi Shift Dress,28.0,£
Women,Clothing,Linen,Pure Linen Long Sleeve Blouse,22.0,£
Women,Clothing,Linen,Pure Linen Floral Relaxed Popover Blouse,22.0,£
Women,Clothing,Linen,Linen Rich Shorts,14.0,£
Women,Clothing,Linen,Tencel™ Cargo Pocket Shorts,20.0,£
Women,Clothing,Linen,Pure Linen Polka Dot Long Sleeve Shirt,22.0,£
Women,Clothing,Linen,Mia Slim Linen Ankle Grazer Trousers,28.0,£
Women,Clothing,Shirts & blouses,Pure Cotton Relaxed Long Sleeve Shirt,19.5,£
Women,Clothing,Shirts & blouses,Floral Disty Woven Short Sleeve Blouse,17.5,£
Women,Clothing,Shirts & blouses,Geometric Print Long Sleeve Shirt,22.5,£
Women,Clothing,Shirts & blouses,Polka Dot Long Sleeve Shirt,22.5,£
Women,Clothing,Shirts & blouses,Pure Linen Popover Blouse,22.0,£
Women,Clothing,Shirts & blouses,Printed Pleat Front Short Sleeve Blouse,19.5,£
Women,Clothing,Shirts & blouses,Pure Cotton Floral Long Sleeve Shirt,19.5,£
Women,Clothing,Shirts & blouses,Geometric V-Neck Sleeveless Shell Top,17.5,£
Women,Clothing,Shirts & blouses,Woven Polka Dot Short Sleeve Blouse,17.5,£
Women,Clothing,Shirts & blouses,Geometric Pleat Front Short Sleeve Blouse,19.5,£
Women,Clothing,Shirts & blouses,Pure Linen Checked Short Sleeve Blouse,20.0,£
Women,Clothing,Shirts & blouses,Pure Linen Floral Popover Blouse,22.0,£
Women,Clothing,Shirts & blouses,Pure Linen Floral Popover Blouse,22.0,£
Women,Clothing,Shirts & blouses,Pure Linen Floral Long Sleeve Shirt,22.0,£
Women,Clothing,Shirts & blouses,Pure Linen Striped Long Sleeve Shirt,22.0,£
Women,Clothing,Shirts & blouses,Pure Cotton Sleeveless Shirt,15.0,£
Women,Clothing,Shirts & blouses,Tie Neck Sleeveless Shell Top,17.5,£
Women,Clothing,Shirts & blouses,Pure Cotton Floral Relaxed Sleeveless Shirt,15.0,£
Women,Clothing,Shirts & blouses,Pure Cotton Striped Relaxed Shirt,19.5,£
Women,Clothing,Shirts & blouses,Printed Sleeveless V-Neck Shell Top,17.5,£
Women,Clothing,Shirts & blouses,Cotton Rich Floral Long Sleeve Blouse,29.5,£
Women,Clothing,Shirts & blouses,Satin Large Leaf Print Long Sleeve Shirt,23.7,£
Women,Clothing,Shirts & blouses,V-Neck Longline Short Sleeve Popover Blouse,29.5,£
Women,Clothing,Shirts & blouses,Pure Cotton Printed Blouson Sleeve Blouse,15.0,£
Women,Clothing,Shirts & blouses,Ditsy Floral Tie Neck Blouson Sleeve Blouse,17.7,£
Women,Clothing,Shirts & blouses,V-Neck Vest,19.5,£
Women,Clothing,Shirts & blouses,Printed Long Sleeve Shirt,13.5,£
Women,Clothing,Shirts & blouses,Printed Woven Short Sleeve Blouse,17.5,£
Women,Clothing,Shirts & blouses,Printed Long Sleeve Shirt,13.5,£
Women,Clothing,Shirts & blouses,Striped Longline Collared Blouse,25.0,£
Women,Clothing,Shirts & blouses,Cotton Rich Polka Dot Fitted Shirt,9.0,£
Women,Clothing,Shirts & blouses,Floral Long Sleeve Shirt,13.5,£
Women,Clothing,Shirts & blouses,Cotton Rich Printed 3/4 Sleeve Blouse,29.5,£
Women,Clothing,Shirts & blouses,V-Neck Popover Blouse,11.7,£
Women,Clothing,Shirts & blouses,Pure Cotton Printed Short Sleeve Blouse,15.0,£
Women,Clothing,Shirts & blouses,Cotton Rich Long Sleeve Blouse,29.5,£
Women,Clothing,Shirts & blouses,V-Neck Shell Top,17.5,£
Women,Clothing,Shirts & blouses,Cotton Rich Fitted Short Sleeve Shirt,15.0,£
Women,Clothing,Shirts & blouses,Printed Woven Blouse,17.5,£
Women,Clothing,Shirts & blouses,Pure Cotton Floral Relaxed Shirt,19.5,£
Women,Clothing,Shirts & blouses,Pure Silk Long Sleeve Shirt,41.4,£
Women,Clothing,Shirts & blouses,Animal Print Long Sleeve Popover Blouse,19.5,£
Women,Clothing,Shirts & blouses,Polka Dot Waisted Long Sleeve Blouse,25.0,£
Women,Clothing,Shirts & blouses,Woven Short Sleeve Blouse,17.5,£
Women,Clothing,Shirts & blouses,Striped Button Detail Long Sleeve Blouse,19.5,£
Women,Clothing,Shirts & blouses,Pleat Front Woven Blouse,11.7,£
Women,Clothing,Shirts & blouses,Cotton Fitted Sleeveless Shirt,15.0,£
Women,Clothing,Shirts & blouses,Pure Linen Floral Relaxed Popover Blouse,22.0,£
Women,Clothing,Knitwear,Ribbed Crew Neck Fitted Short Sleeve Jumper,15.0,£
Women,Clothing,Knitwear,Pure Cotton Textured Relaxed Jumper,25.0,£
Women,Clothing,Knitwear,Textured Round Neck Short Sleeve Knitted Top,12.5,£
Women,Clothing,Knitwear,Linen Ribbed Longline Cardigan,23.6,£
Women,Clothing,Knitwear,Linen Ribbed Longline Cardigan,23.6,£
Women,Clothing,Knitwear,Cotton Knitted Wrap Cardigan,35.0,£
Women,Clothing,Knitwear,Cotton Knitted Wrap Cardigan,35.0,£
Women,Clothing,Knitwear,Pure Cotton Relaxed Cardigan,19.5,£
Women,Clothing,Knitwear,Pure Cashmere Round Neck Jumper,79.0,£
Women,Clothing,Knitwear,Round Neck Jumper,15.0,£
Women,Clothing,Knitwear,Pure Merino Wool Crew Neck Jumper,29.5,£
Women,Clothing,Knitwear,Pure Cotton Relaxed Fit V-Neck Jumper,19.5,£
Women,Clothing,Knitwear,Cotton Striped Relaxed Jumper,29.5,£
Women,Clothing,Knitwear,V-Neck Jumper,15.0,£
Women,Clothing,Knitwear,Pure Cashmere V-Neck Jumper,79.0,£
Women,Clothing,Knitwear,Pure Cotton Round Neck Jumper,19.5,£
Women,Clothing,Knitwear,Pure Cotton Longline Sweatshirt,25.0,£
Women,Clothing,Knitwear,Pure Cotton Striped Short Sleeve Jumper,15.0,£
Women,Clothing,Knitwear,Pure Merino Wool Relaxed Fit V-Neck Jumper,29.5,£
Women,Clothing,Knitwear,Pure Cotton Spot Print Crew Neck Jumper,19.5,£
Women,Clothing,Knitwear,Pure Cashmere Colourblock Crew Neck Jumper,99.0,£
Women,Clothing,Knitwear,Pure Cotton Striped Relaxed Fit Jumper,19.5,£
Women,Clothing,Knitwear,Pure Cotton Star Print V-Neck Jumper,19.5,£
Women,Clothing,Knitwear,Polka Dot Crew Neck Cardigan,17.5,£
Women,Clothing,Knitwear,Textured Knitted Top,19.5,£
Women,Clothing,Knitwear,Pure Cashmere Cropped Hoodie,119.0,£
Women,Clothing,Knitwear,Printed Round Neck Cardigan,17.5,£
Women,Clothing,Knitwear,Pure Cotton Relaxed Jumper,25.0,£
Women,Clothing,Knitwear,Pure Cashmere Striped Long Sleeve Jumper,99.0,£
Women,Clothing,Knitwear,Pure Cashmere Roll Neck Jumper,89.0,£
Women,Clothing,Knitwear,Soft Touch Polka Dot Hooded Sweatshirt,25.0,£
Women,Clothing,Knitwear,Pure Cashmere V-Neck Relaxed Jumper,89.0,£
Women,Clothing,Knitwear,Mini Cable Knit Round Neck Jumper,25.0,£
Women,Clothing,Knitwear,Short Sleeve Relaxed Cardigan with Linen,20.0,£
Women,Clothing,Knitwear,Striped V-Neck Jumper with Linen,20.0,£
Women,Clothing,Knitwear,Textured Regular Fit Longline Cardigan,16.5,£
Women,Clothing,Knitwear,Pure Merino Wool Colour Block Jumper,29.5,£
Women,Clothing,Knitwear,Cotton Ribbed Crew Neck Jumper,29.5,£
Women,Clothing,Knitwear,Pure Cotton Heart Print Relaxed Fit Jumper,19.5,£
Women,Clothing,Knitwear,Waterfall Longline Cardigan with Linen,20.0,£
Women,Clothing,Knitwear,Colour Block Batwing Sleeve Jumper,35.0,£
Women,Clothing,Knitwear,Printed Midi Cardigan with Linen,23.6,£
Women,Clothing,Knitwear,Pure Merino Wool Striped Crew Neck Jumper,29.5,£
Women,Clothing,Knitwear,Crew Neck Fitted Short Sleeve Top,15.0,£
Women,Clothing,Knitwear,Pure Cotton Striped Crew Neck Jumper,15.0,£
Women,Clothing,Knitwear,Cotton Long Sleeve Jumper,29.5,£
Women,Clothing,Knitwear,Printed Round Neck Jumper,15.0,£
Women,Clothing,Knitwear,Pure Cashmere Round Neck Cardigan,89.0,£
Women,Clothing,Leggings & joggers,2 Pack High Waist Leggings,15.0,£
Women,Clothing,Leggings & joggers,Cotton Rich Straight Leg Joggers,12.5,£
Women,Clothing,Leggings & joggers,Cotton Rich Straight Leg Ankle Grazer Jogger,25.0,£
Women,Clothing,Leggings & joggers,Magic High Waist Leggings,19.5,£
Women,Clothing,Leggings & joggers,High Waist Leggings,9.5,£
Women,Clothing,Leggings & joggers,Cotton Rich Cuffed Joggers,25.0,£
Women,Clothing,Leggings & joggers,Cotton Rich Straight Leg Cropped Jogger,9.5,£
Women,Clothing,Leggings & joggers,High Waist Leggings,12.5,£
Women,Clothing,Leggings & joggers,Cotton Side Stripe Straight Leg Joggers,15.0,£
Women,Clothing,Leggings & joggers,High Waisted Cropped Leggings,7.5,£
Women,Clothing,Leggings & joggers,CURVE Cotton Rich Straight Leg Joggers,12.5,£
Women,Clothing,Leggings & joggers,Cotton Rich Straight Leg Cropped Jogger,9.5,£
Women,Clothing,Leggings & joggers,Side Stripe High Waist Leggings,19.5,£
Women,Clothing,Leggings & joggers,Cotton Rich Straight Leg Joggers,12.5,£
Women,Clothing,Leggings & joggers,Side Stripe Slim Fit Cuffed Joggers,25.0,£
Women,Clothing,Leggings & joggers,Go Easy Yoga Leggings,15.0,£
Women,Clothing,Leggings & joggers,Cotton Rich Straight Leg Ankle Grazer Jogger,25.0,£
Women,Clothing,Leggings & joggers,Printed Cropped Leggings,19.5,£
Women,Clothing,Leggings & joggers,Cotton Rich Cargo Ankle Grazer Trousers,25.0,£
Women,Clothing,Leggings & joggers,Cotton Rich Straight Leg Joggers,12.5,£
Women,Clothing,Leggings & joggers,Go Easy Active Cotton Cropped Leggings,12.5,£
Women,Clothing,Leggings & joggers,Performance Cuffed Joggers,25.0,£
Women,Clothing,Leggings & joggers,Go Move Gym Leggings,25.0,£
Women,Clothing,Leggings & joggers,High Waist Leggings,9.5,£
Women,Clothing,Leggings & joggers,Cotton Rich Straight Leg Cropped Jogger,9.5,£
Women,Clothing,Leggings & joggers,Woven Mesh Panelled Cuffed Joggers,25.0,£
Women,Clothing,Leggings & joggers,Woven Cropped Joggers,19.5,£
Women,Clothing,Leggings & joggers,Go Move Cropped Gym Leggings,19.5,£
Women,Clothing,Leggings & joggers,Magic High Waist Leggings,19.5,£
Women,Clothing,Leggings & joggers,Quick Dry Yoga Joggers,16.0,£
Women,Clothing,Leggings & joggers,Side Stripe High Waist Leggings,19.5,£
Women,Clothing,Leggings & joggers,Performance Cuffed Joggers,25.0,£
Women,Clothing,Leggings & joggers,Cotton Rich Cropped Leggings,7.5,£
Women,Clothing,Leggings & joggers,Go Move Gym Leggings,25.0,£
Women,Clothing,Leggings & joggers,Modal Rich Jersey Tapered Leg Joggers,22.5,£
Women,Clothing,Leggings & joggers,Modal Rich Jersey Tapered Leg Joggers,22.5,£
Women,Clothing,Leggings & joggers,Magic High Waist Leggings,19.5,£
Women,Clothing,Leggings & joggers,Animal Print Coated High Waisted Leggings,19.5,£
Women,Clothing,Leggings & joggers,Go Train 7/8 Gym Leggings,29.5,£
Women,Clothing,Leggings & joggers,Go Train Gym Leggings,25.0,£
Women,Clothing,Leggings & joggers,Go Move Cropped Gym Leggings,19.5,£
Women,Clothing,Leggings & joggers,Stay New™ High Waisted Leggings,9.5,£
Women,Clothing,Leggings & joggers,High Waisted Leggings,12.5,£
Women,Clothing,Leggings & joggers,Coated High Waisted Leggings,19.5,£
Women,Clothing,Leggings & joggers,Go Perform Compression Leggings,45.0,£
Women,Clothing,Leggings & joggers,High Waist Leggings,9.5,£
Women,Clothing,Leggings & joggers,Tapered Leg Joggers,35.0,£
Women,Clothing,Leggings & joggers,Dogtooth Coated High Waisted Leggings,19.5,£
Women,Clothing,Jeans,High Waisted Jeggings,15.0,£
Women,Clothing,Jeans,Boyfriend Ripped Jeans,35.0,£
Women,Clothing,Jeans,Cotton Rich Skinny Button Front Jeans,45.0,£
Women,Clothing,Jeans,Boyfriend Jeans,39.5,£
Women,Clothing,Jeans,Boyfriend Jeans,39.5,£
Women,Clothing,Jeans,Ivy Skinny Jeans,19.5,£
Women,Clothing,Jeans,Sophia High Waist Straight Fit Jeans,29.5,£
Women,Clothing,Jeans,Sienna Button Front Straight Fit Jeans,19.5,£
Women,Clothing,Jeans,Sienna Button Front Straight Fit Jeans,19.5,£
Women,Clothing,Jeans,Carrie Super Soft Skinny Jeans,29.5,£
Women,Clothing,Jeans,Lily Slim Leg Jeans,19.5,£
Women,Clothing,Jeans,Eva Bootcut Mid Rise Jeans,19.5,£
Women,Clothing,Jeans,Relaxed Slim Ankle Grazer Jeans,25.0,£
Women,Clothing,Jeans,High Waist Super Skinny Jeans,19.5,£
Women,Clothing,Jeans,Relaxed Mid Rise Ankle Grazer Jeans,25.0,£
Women,Clothing,Jeans,Sateen Roma Rise Straight Leg Jeans,35.0,£
Women,Clothing,Jeans,Utilty Wide Leg Ankle Grazer Jeans,25.0,£
Women,Clothing,Jeans,Harper Super Soft Cigarette Jeans,29.5,£
Women,Clothing,Jeans,Harper Super Soft Cigarette Jeans,29.5,£
Women,Clothing,Jeans,Sophia High Waist Straight Fit Jeans,29.5,£
Women,Clothing,Jeans,Sienna Button Front Straight Fit Jeans,19.5,£
Women,Clothing,Jeans,Utility High Waist Wide Leg Cropped Jeans,25.0,£
Women,Clothing,Jeans,Sienna Button Front Straight Fit Jeans,19.5,£
Women,Clothing,Jeans,Lily Slim Leg Jeans,19.5,£
Women,Clothing,Jeans,Sienna Button Front Straight Fit Jeans,19.5,£
Women,Clothing,Jeans,High Waisted Jeggings,15.0,£
Women,Clothing,Jeans,Ivy Skinny Jeans,19.5,£
Women,Clothing,Jeans,High Waisted Scarf Belt Wide Leg Jeans,35.0,£
Women,Clothing,Jeans,Tencel™ High Waisted Wide Leg Jeans,35.0,£
Women,Clothing,Jeans,Roma Rise Straight Leg Jeans,35.0,£
Women,Clothing,Jeans,Sienna Button Front Straight Fit Jeans,19.5,£
Women,Clothing,Jeans,Embroidered Straight Leg Ankle Grazer Jeans,45.0,£
Women,Clothing,Jeans,Magic Shaping High Waist Straight Fit Jeans,39.5,£
